ProductNameEN;ImageLink;Price;DescriptionEN;DescriptionDE;ProductNameDE
Weed;gras.jpg;10$;The best weed you can get!;Das beste Graß was ihr bekommen könnt!;Graß
Fentanyl;weis.jpg;40$;The best fentanyl you can get!;Das beste Fentanyl was ihr bekommen könnt!;Fentanyl
Ecstasy;pills.jpg;15$;The best ecstasy you can get!;Das beste Ecstasy was ihr bekommen könnt!;Ecstasy
LSD;lsd_1765285321.webp;12;The best LSD you can get!;Das beste LSD was ihr bekommen könnt!;LSD
dd;dd_1768307568.png;22;dsdsa;gggggg;aaa